S.N.,Traded Companies,No. Of Transaction,Max Price,Min Price,Closing Price,Traded Shares,Amount,Previous Closing,Difference Rs.
1,Ace Development Bank Ltd.,4,226.00,222.00,225.00,520.00,116500.00,230.00,-5.00
2,Api Finance Limited,2,230.00,226.00,230.00,20.00,4560.00,230.00,0.00
3,Arun Valley Hydropower Development Co. Ltd.,24,500.00,454.00,472.00,690.00,333870.00,494.00,-22.00
4,Axis Development Bank Limited,10,213.00,213.00,213.00,250.00,53250.00,212.00,1.00
5,Bank of Kathmandu Ltd.,26,786.00,722.00,757.00,2518.00,1851600.00,802.00,-45.00
6,Bishal Bazar Company Limited,1,3100.00,3100.00,3100.00,400.00,1240000.00,3100.00,0.00
7,Business Universal Development Bank Ltd.,5,173.00,167.00,167.00,329.00,56140.00,170.00,-3.00
8,Capital Merchant Bank & Finance Co. Ltd.,8,198.00,192.00,198.00,746.00,144072.00,195.00,3.00
9,Citizen Bank International Limited,42,441.00,409.00,418.00,1880.00,783890.00,439.00,-21.00
10,Citizen Investment Trust,5,630.00,630.00,630.00,75.00,47250.00,640.00,-10.00
11,Civil Merchant Bittiya Santha Ltd.,1,227.00,227.00,227.00,100.00,22700.00,231.00,-4.00
12,Clean Energy Development Bank Limited,2,470.00,470.00,470.00,20.00,9400.00,473.00,-3.00
13,Crystal Finance Ltd.,9,233.00,230.00,233.00,140.00,32460.00,230.00,3.00
14,Deva Bikas Bank Limited,3,177.00,171.00,171.00,306.00,53247.00,180.00,-9.00
15,Everest Bank Limited,28,1404.00,1248.00,1404.00,781.00,1019188.00,1342.00,62.00
16,Everest Insurance Co. Ltd.,1,294.00,294.00,294.00,33.00,9702.00,289.00,5.00
17,Fewa Finance Co. Ltd.,3,274.00,274.00,274.00,200.00,54800.00,274.00,0.00
18,Global IME Bank Limited,25,266.00,256.00,260.00,1160.00,301280.00,257.00,3.00
19,Grand Bank Nepal Limited,2,245.00,241.00,241.00,206.00,49750.00,249.00,-8.00
20,Gurkhas Finance Ltd.,3,179.00,173.00,173.00,30.00,5280.00,182.00,-9.00
21,Himalayan Bank Limited,11,1025.00,961.00,1006.00,225.00,222615.00,1006.00,0.00
22,ICFC Finance Limited,11,254.00,234.00,234.00,1370.00,329672.00,259.00,-25.00
23,Infrastructure Development Bank Ltd.,1,258.00,258.00,258.00,40.00,10320.00,263.00,-5.00
24,Janaki Finance Ltd.,2,341.00,335.00,335.00,100.00,33800.00,335.00,0.00
25,Kaski Finance Limited,3,229.00,229.00,229.00,30.00,6870.00,233.00,-4.00
26,Kumari Bank Limited,15,415.00,387.00,387.00,1548.00,606967.00,423.00,-36.00
27,Laxmi Bank Limited,16,440.00,404.00,404.00,1019.00,419328.00,448.00,-44.00
28,Lord Buddha Finance Limited,3,182.00,179.00,182.00,298.00,53660.00,182.00,0.00
29,Lumbini Bank Limited,6,255.00,241.00,241.00,658.00,162240.00,260.00,-19.00
30,Lumbini Bikas Bank Ltd.,94,305.00,262.00,267.00,4410.00,1204900.00,291.00,-24.00
31,Lumbini Finance Ltd.,19,255.00,232.00,232.00,2534.00,600170.00,255.00,-23.00
32,Lumbini General Insurance Co. Ltd.,1,150.00,150.00,150.00,20.00,3000.00,150.00,0.00
33,Machhapuchhre Bank Limited,8,283.00,265.00,266.00,843.00,230465.00,283.00,-17.00
34,Madhyamanchal Gramin Development Bank Ltd.,27,183.00,174.00,174.00,340.00,60960.00,181.00,-7.00
35,Mahakali Bikas Bank Limited,6,210.00,208.00,210.00,70.00,14660.00,212.00,-2.00
36,Miteri Development Bank Limited,2,232.00,232.00,232.00,40.00,9280.00,236.00,-4.00
37,Nabil Bank Limited,24,2194.00,2039.00,2075.00,1664.00,3492793.00,2200.00,-125.00
38,National Hydro Power Company Limited,15,51.00,47.02,48.96,10300.00,502846.00,52.00,-3.04
39,Nava Durga Finance Co. Ltd.,1,235.00,235.00,235.00,40.00,9400.00,265.00,-30.00
40,Nepal Bangladesh Bank Limited,9,231.00,212.00,212.00,1945.00,428620.00,231.00,-19.00
41,Nepal Credit And Commercial Bank Limited,2,245.00,245.00,245.00,200.00,49000.00,250.00,-5.00
42,Nepal Doorsanchar Comapany Limited,15,465.00,450.00,450.00,2310.00,1053020.00,474.00,-24.00
43,Nepal Express Finance Ltd.,5,240.00,240.00,240.00,144.00,34560.00,243.00,-3.00
44,Nepal Housing & Merchant Finance Ltd.,2,295.00,295.00,295.00,38.00,11210.00,295.00,0.00
45,Nepal Investment Bank Limited,11,729.00,649.00,661.00,1114.00,765840.00,720.00,-59.00
46,Nepal SBI Bank Limited,9,755.00,693.00,693.00,818.00,585836.00,770.00,-77.00
47,Nepal Shree Lanka Merchant Banking & Finance Ltd,10,79.00,72.00,72.00,700.00,52320.00,80.00,-8.00
48,NIC Asia Bank Ltd.,34,555.00,510.00,525.00,3010.00,1590630.00,548.00,-23.00
49,Nirdhan Utthan Laghubitta Bittiya Sanstha Limited,2,242.00,238.00,242.00,20.00,4800.00,234.00,8.00
50,Paschimanchal Bikash Bank Limited,1,287.00,287.00,287.00,30.00,8610.00,289.00,-2.00
51,Paschimanchal Finance Co. Ltd.,4,200.00,191.00,200.00,742.00,147062.00,188.00,12.00
52,Pathibhara Bikas Bank Limited,22,315.00,292.00,292.00,290.00,87770.00,324.00,-32.00
53,Peoples Finance Ltd.,2,239.00,235.00,239.00,40.00,9440.00,225.00,14.00
54,Prabhu  Bank Limited,4,190.00,187.00,187.00,2700.00,508900.00,192.00,-5.00
55,Prime Commercial Bank Ltd.,28,440.00,390.00,390.00,1335.00,554271.00,435.00,-45.00
56,ProgressiveFinance Limited,6,325.00,324.00,324.00,180.00,58460.00,330.00,-6.00
57,Public Development Bank Limited,16,142.00,138.00,140.00,450.00,63000.00,142.00,-2.00
58,Rastriya Beema Company Limited,8,294.00,290.00,290.00,575.00,168750.00,300.00,-10.00
59,Rastriya Beema Company Limited,2,1336.00,1336.00,1336.00,36.00,48096.00,1336.00,0.00
60,Samriddhi Finance Company Limited,4,166.00,160.00,160.00,283.00,46633.00,169.00,-9.00
61,Sanima Bank Limited,12,400.00,360.00,360.00,625.00,234010.00,394.00,-34.00
62,Shikhar Finance Limited,4,162.00,160.00,160.00,50.00,8040.00,159.00,1.00
63,Shikhar Insurance Co. Ltd.,1,321.00,321.00,321.00,10.00,3210.00,315.00,6.00
64,Shrijana Finance  (Bittaya Sanstha),4,121.00,117.00,121.00,2330.00,276998.00,115.00,6.00
65,Siddhartha Bank Limited,9,390.00,369.00,370.00,793.00,297918.00,397.00,-27.00
66,Siddhartha Insurance Ltd.,10,124.00,124.00,124.00,100.00,12400.00,122.00,2.00
67,Standard Chartered Bank Limited,24,2901.00,2800.00,2830.00,1209.00,3442719.00,2920.00,-90.00
68,Standard Finance Ltd.,3,201.00,194.00,194.00,206.00,40709.00,205.00,-11.00
69,Sunrise Bank Limited,28,313.00,290.00,290.00,1370.00,416520.00,312.00,-22.00
70,Supreme Development Bank Ltd.,8,141.00,135.00,135.00,825.00,113310.00,143.00,-8.00
71,Triveni Bikas Bank Limited,8,325.00,309.00,325.00,270.00,86160.00,303.00,22.00
