S.N.,Traded Companies,No. Of Transaction,Max Price,Min Price,Closing Price,Traded Shares,Amount,Previous Closing,Difference Rs.
1,Agriculture Development Bank Limited,3,129.00,125.00,129.00,100.00,12700.00,123.00,6.00
2,Alpine Development Bank Limited,1,112.00,112.00,112.00,10.00,1120.00,110.00,2.00
3,Apex Development Bank Ltd.,1,100.00,100.00,100.00,108.00,10800.00,100.00,0.00
4,Araniko Development Bank Limited,3,92.00,92.00,92.00,90.00,8280.00,91.00,1.00
5,Arun Valley Hydropower Development Co. Ltd.,11,336.00,330.00,336.00,342.00,113328.00,327.00,9.00
6,Bank of Asia Nepal Limited,1,234.00,234.00,234.00,20.00,4680.00,230.00,4.00
7,Bank of Kathmandu Ltd.,103,631.00,585.00,631.00,23993.00,15066349.00,574.00,57.00
8,Bishal Bazar Company Limited,2,2126.00,2084.00,2084.00,1492.00,3109748.00,2169.00,-85.00
9,Chilime Hydropower Company Limited,4,827.00,781.00,827.00,590.00,471690.00,766.00,61.00
10,Citizen Bank International Limited,8,261.00,242.00,261.00,1096.00,274512.00,238.00,23.00
11,Civil Merchant Bittiya Santha Ltd.,4,115.00,111.00,115.00,50.00,5650.00,109.00,6.00
12,Clean Energy Development Bank Limited,1,168.00,168.00,168.00,1008.00,169344.00,165.00,3.00
13,Country Development Bank Ltd.,14,93.00,91.00,92.00,580.00,53400.00,92.00,0.00
14,Deprosc Laghubitta Bittiya Sanstha Limited,2,291.00,286.00,291.00,30.00,8680.00,281.00,10.00
15,Deva Bikas Bank Limited,7,111.00,103.00,111.00,1736.00,186208.00,101.00,10.00
16,Everest Bank Limited,23,988.00,911.00,988.00,1848.00,1798659.00,899.00,89.00
17,Excel Development Bank Ltd.,1,258.00,258.00,258.00,82.00,21156.00,253.00,5.00
18,Fewa Finance Co. Ltd.,4,171.00,162.00,171.00,80.00,13320.00,159.00,12.00
19,Gandaki Bikas Bank Limited,5,153.00,148.00,153.00,220.00,33140.00,146.00,7.00
20,Garima Bikas Bank Limited,3,161.00,155.00,161.00,80.00,12580.00,152.00,9.00
21,Grand Bank Nepal Limited,19,210.00,195.00,210.00,12259.00,2484932.00,192.00,18.00
22,Gurans Life Insurance Company Ltd.,16,116.00,110.00,116.00,2650.00,307280.00,108.00,8.00
23,Himalayan Bank Limited,1,612.00,612.00,612.00,386.00,236232.00,600.00,12.00
24,Himalayan Finance Limited (Bittiya Sanstha),10,70.00,68.00,70.00,280.00,19130.00,67.00,3.00
25,Jyoti Bikas Bank Limited,3,110.00,106.00,110.00,190.00,20520.00,104.00,6.00
26,Kamana Sewa Bikas Bank Limited,4,126.00,120.00,126.00,420.00,50940.00,118.00,8.00
27,Kaski Finance Limited,3,127.00,123.00,127.00,112.00,14104.00,121.00,6.00
28,Kumari Bank Limited,1,256.00,256.00,256.00,174.00,44544.00,251.00,5.00
29,Laxmi Bank Limited,39,344.00,315.00,344.00,25399.00,8707052.00,313.00,31.00
30,Lumbini Bank Limited,10,247.00,229.00,247.00,1755.00,428495.00,225.00,22.00
31,Lumbini General Insurance Co. Ltd.,8,74.00,74.00,74.00,160.00,11840.00,73.00,1.00
32,Mahalaxmi Bikas Bank Ltd.,2,78.00,77.00,78.00,140.00,10870.00,76.00,2.00
33,Mahalaxmi BikasBank Limited,4,125.00,125.00,125.00,360.00,45000.00,127.00,-2.00
34,Muktinath Bikas Bank Ltd.,7,251.00,233.00,251.00,320.00,77820.00,229.00,22.00
35,Nabil Bank Limited,13,1320.00,1224.00,1320.00,880.00,1154840.00,1200.00,120.00
36,National Hydro Power Company Limited,4,61.38,58.14,61.38,1800.00,109564.00,57.00,4.38
37,National Life Insurance Co. Ltd.,4,381.00,365.00,381.00,1707.00,637545.00,358.00,23.00
38,Nepal Bangladesh Bank Limited,12,140.00,130.00,140.00,3160.00,439110.00,128.00,12.00
39,Nepal Credit And Commercial Bank Limited,9,144.00,132.00,144.00,1530.00,205500.00,134.00,10.00
40,Nepal Doorsanchar Comapany Limited,4,483.00,475.00,476.00,1125.00,536740.00,466.00,10.00
41,Nepal Investment Bank Limited,13,548.00,508.00,548.00,2321.00,1267276.00,499.00,49.00
42,Nepal Life Insurance Co. Ltd.,9,846.00,815.00,830.00,1776.00,1473540.00,820.00,10.00
43,Nepal SBI Bank Limited,15,649.00,601.00,649.00,3245.00,2009018.00,590.00,59.00
44,NIC Asia Bank Ltd.,35,576.00,534.00,576.00,6657.00,3824887.00,524.00,52.00
45,NMB Bank Limited,8,227.00,211.00,227.00,1660.00,376060.00,207.00,20.00
46,Patan Finance Limited,1,117.00,117.00,117.00,10.00,1170.00,112.00,5.00
47,Prabhu  Bank Limited,16,149.00,138.00,149.00,7975.00,1151289.00,136.00,13.00
48,Prime Commercial Bank Ltd.,15,262.00,243.00,262.00,2654.00,686818.00,239.00,23.00
49,Prime Life Insurance Company Limited,2,184.00,184.00,184.00,5900.00,1085600.00,184.00,0.00
50,Professional Bikas Bank Ltd.,2,79.00,78.00,79.00,100.00,7850.00,77.00,2.00
51,Public Development Bank Limited,31,69.00,69.00,69.00,370.00,25530.00,68.00,1.00
52,Rara Bikas Bank Limited,9,95.00,92.00,95.00,290.00,26990.00,92.00,3.00
53,Rastriya Beema Company Limited,7,158.00,151.00,158.00,1000.00,152320.00,149.00,9.00
54,Reliable Development Bank Limited,1,169.00,169.00,169.00,12.00,2028.00,166.00,3.00
55,Sanima Bank Limited,6,242.00,226.00,242.00,6186.00,1440348.00,222.00,20.00
56,Sanima Bank Ltd. Promoter Share,2,167.00,164.00,164.00,200.00,33100.00,275.00,-111.00
57,Seti Finance Limited,1,79.00,79.00,79.00,20.00,1580.00,78.00,1.00
58,Shikhar Insurance Co. Ltd.,1,252.00,252.00,252.00,10.00,2520.00,248.00,4.00
59,Shree Investment Finance Co. Ltd.,1,174.00,174.00,174.00,1735.00,301890.00,171.00,3.00
60,Society Development Bank Ltd.,9,116.00,110.00,116.00,640.00,70860.00,110.00,6.00
61,Standard Chartered Bank Limited,21,1980.00,1836.00,1980.00,1191.00,2337428.00,1800.00,180.00
62,Subha Laxmi Finance Co. Ltd.,1,91.00,91.00,91.00,20.00,1820.00,92.00,-1.00
63,Subhechha Bikas Bank Limited,1,120.00,120.00,120.00,30.00,3600.00,118.00,2.00
64,Sunrise Bank Limited,13,181.00,162.00,181.00,2326.00,408655.00,165.00,16.00
65,Surya Life Insurance Company Limited,1,120.00,120.00,120.00,60.00,7200.00,118.00,2.00
66,Unique Finance Ltd.,1,108.00,108.00,108.00,10.00,1080.00,108.00,0.00
67,Western Development Bank Limited,7,114.00,112.00,113.00,84.00,9468.00,113.00,0.00
68,Zenith Finance Limited,3,116.00,112.00,116.00,36.00,4104.00,110.00,6.00
