S.N.,Traded Companies,No. Of Transaction,Max Price,Min Price,Closing Price,Traded Shares,Amount,Previous Closing,Difference Rs.
1,Ace Development Bank Ltd.,5,156.00,153.00,153.00,817.00,126414.00,156.00,-3.00
2,Agriculture Development Bank Limited,48,142.00,134.00,139.00,6548.00,909268.00,141.00,-2.00
3,Alpine Development Bank Limited,6,114.00,112.00,114.00,70.00,7880.00,114.00,0.00
4,Api Finance Limited,1,136.00,136.00,136.00,100.00,13600.00,134.00,2.00
5,Arun Valley Hydropower Development Co. Ltd.,15,351.00,333.00,338.00,2628.00,889774.00,358.00,-20.00
6,Asian Life Insurance Co. Limited,12,210.00,205.00,205.00,830.00,172000.00,206.00,-1.00
7,Bagheshwori Development Bank Limited,1,290.00,290.00,290.00,20.00,5800.00,293.00,-3.00
8,Bank of Asia Nepal Limited,63,281.00,259.00,265.00,11449.00,3038679.00,286.00,-21.00
9,Bank of Kathmandu Ltd.,137,698.00,632.00,665.00,24650.00,16329801.00,696.00,-31.00
10,Butwal Power Company Limited,11,593.00,545.00,561.00,1294.00,728716.00,605.00,-44.00
11,Chilime Hydropower Company Limited,74,881.00,840.00,870.00,7492.00,6473690.00,886.00,-16.00
12,Citizen Bank International Limited,46,275.00,250.00,266.00,9000.00,2358348.00,270.00,-4.00
13,Civil Merchant Bittiya Santha Ltd.,1,141.00,141.00,141.00,10.00,1410.00,139.00,2.00
14,Clean Energy Development Bank Limited,17,180.00,165.00,169.00,3108.00,526112.00,183.00,-14.00
15,Country Development Bank Ltd.,5,88.00,87.00,87.00,130.00,11350.00,89.00,-2.00
16,Everest Bank Limited,42,1074.00,1010.00,1060.00,4824.00,4954248.00,1070.00,-10.00
17,Everest Insurance Co. Ltd.,1,267.00,267.00,267.00,33.00,8811.00,272.00,-5.00
18,Gandaki Bikas Bank Limited,2,145.00,145.00,145.00,100.00,14500.00,145.00,0.00
19,Garima Bikas Bank Limited,6,157.00,154.00,156.00,280.00,43490.00,158.00,-2.00
20,Grand Bank Nepal Limited,48,252.00,227.00,238.00,10239.00,2433056.00,252.00,-14.00
21,Himalayan Bank Limited,29,720.00,670.00,695.00,3243.00,2230954.00,686.00,9.00
22,ICFC Finance Limited,9,170.00,161.00,164.00,268.00,43898.00,167.00,-3.00
23,Janaki Finance Ltd.,2,297.00,292.00,297.00,41.00,12127.00,287.00,10.00
24,Jyoti Bikas Bank Limited,5,107.00,103.00,107.00,200.00,20900.00,105.00,2.00
25,Kabeli Bikas Bank Limited,3,132.00,132.00,132.00,90.00,11880.00,134.00,-2.00
26,Kamana Sewa Bikas Bank Limited,16,122.00,118.00,120.00,1600.00,191240.00,124.00,-4.00
27,Kankai Bikas Bank Ltd.,3,120.00,116.00,120.00,120.00,14100.00,114.00,6.00
28,Kumari Bank Limited,49,285.00,254.00,271.00,6991.00,1868420.00,269.00,2.00
29,Laxmi Bank Limited,36,388.00,346.00,368.00,4616.00,1660368.00,375.00,-7.00
30,Life Insurance Co. Nepal,7,900.00,883.00,900.00,980.00,878570.00,908.00,-8.00
31,Lumbini Bank Limited,33,272.00,252.00,252.00,6055.00,1566484.00,270.00,-18.00
32,Mahakali Bikas Bank Limited,1,119.00,119.00,119.00,40.00,4760.00,119.00,0.00
33,Mahalaxmi BikasBank Limited,1,131.00,131.00,131.00,84.00,11004.00,133.00,-2.00
34,Miteri Development Bank Limited,5,140.00,138.00,138.00,600.00,83320.00,138.00,0.00
35,Muktinath Bikas Bank Ltd.,21,283.00,260.00,260.00,1330.00,358350.00,288.00,-28.00
36,Nabil Bank Limited,20,1458.00,1390.00,1450.00,1648.00,2327766.00,1450.00,0.00
37,National Hydro Power Company Limited,25,80.00,73.00,73.00,24110.00,1813540.00,81.00,-8.00
38,National Life Insurance Co. Ltd.,7,558.00,537.00,537.00,625.00,339985.00,528.00,9.00
39,Nepal Bangladesh Bank Limited,41,146.00,138.00,142.00,11765.00,1675685.00,144.00,-2.00
40,Nepal Credit And Commercial Bank Limited,2,142.00,140.00,140.00,420.00,59200.00,143.00,-3.00
41,Nepal Doorsanchar Comapany Limited,11,501.00,479.00,490.00,1260.00,618660.00,507.00,-17.00
42,Nepal Investment Bank Limited,53,577.00,533.00,560.00,7697.00,4270140.00,541.00,19.00
43,Nepal SBI Bank Limited,23,675.00,638.00,658.00,3350.00,2192007.00,662.00,-4.00
44,Nerude Laghubita Bikas Bank Limited,1,440.00,440.00,440.00,10.00,4400.00,440.00,0.00
45,NIC Asia Bank Ltd.,40,593.00,552.00,553.00,4586.00,2589849.00,583.00,-30.00
46,NIDC Capital Markets Ltd.,2,176.00,173.00,173.00,300.00,52500.00,176.00,-3.00
47,Nilgiri Bikas Bank Limited,1,138.00,138.00,138.00,20.00,2760.00,140.00,-2.00
48,NMB Bank Limited,28,239.00,227.00,235.00,8161.00,1911109.00,243.00,-8.00
49,Oriental Hotels Limited,1,73.00,73.00,73.00,210.00,15330.00,74.00,-1.00
50,Patan Finance Limited,2,128.00,126.00,126.00,110.00,13880.00,130.00,-4.00
51,Prabhu  Bank Limited,15,142.00,134.00,138.00,2750.00,377600.00,144.00,-6.00
52,Prime Commercial Bank Ltd.,135,286.00,262.00,267.00,25485.00,6804468.00,291.00,-24.00
53,Prime Life Insurance Company Limited,9,198.00,189.00,196.00,468.00,90448.00,202.00,-6.00
54,ProgressiveFinance Limited,1,129.00,129.00,129.00,700.00,90300.00,127.00,2.00
55,Public Development Bank Limited,13,82.00,76.00,81.00,500.00,39920.00,77.00,4.00
56,Rara Bikas Bank Limited,78,85.00,80.00,81.00,2300.00,189560.00,86.00,-5.00
57,Sagarmatha  Finance Limited,1,127.00,127.00,127.00,112.00,14224.00,125.00,2.00
58,Sanima Bank Limited,43,272.00,248.00,264.00,6948.00,1819549.00,273.00,-9.00
59,Shangrila Development Bank Ltd.,22,232.00,232.00,232.00,1240.00,287680.00,244.00,-12.00
60,Shikhar Insurance Co. Ltd.,4,258.00,255.00,255.00,460.00,118080.00,253.00,2.00
61,Shree Investment Finance Co. Ltd.,1,189.00,189.00,189.00,40.00,7560.00,186.00,3.00
62,Siddhartha Bank Limited,40,385.00,357.00,365.00,5590.00,2038348.00,378.00,-13.00
63,Siddhartha Development Bank Ltd.,4,126.00,120.00,120.00,460.00,56320.00,128.00,-8.00
64,Standard Chartered Bank Limited,18,2025.00,1960.00,1995.00,1391.00,2769901.00,2050.00,-55.00
65,Subha Laxmi Finance Co. Ltd.,3,110.00,108.00,110.00,60.00,6520.00,108.00,2.00
66,Sunrise Bank Limited,36,173.00,158.00,170.00,4373.00,719681.00,170.00,0.00
67,Tinau Development Bank Limited,49,105.00,105.00,105.00,730.00,76650.00,105.00,0.00
68,United Finance Ltd.,1,136.00,136.00,136.00,10.00,1360.00,134.00,2.00
69,Valley Finance Limited,1,98.00,98.00,98.00,60.00,5880.00,100.00,-2.00
70,Western Development Bank Limited,5,106.00,104.00,104.00,162.00,16902.00,108.00,-4.00
71,Zenith Finance Limited,2,110.00,108.00,108.00,36.00,3936.00,110.00,-2.00
