S.N.,Traded Companies,No. Of Transaction,Max Price,Min Price,Closing Price,Traded Shares,Amount,Previous Closing,Difference Rs.
1,Agriculture Development Bank Limited,22,129.00,125.00,129.00,1261.00,161332.00,127.00,2.00
2,Alpic Everest Finance Co. Ltd.,1,171.00,171.00,171.00,47.00,8037.00,168.00,3.00
3,Alpic Everest Finance Limited Promotor Share,2,130.00,130.00,130.00,900.00,117000.00,130.00,0.00
4,Alpine Development Bank Limited,3,131.00,129.00,129.00,60.00,7780.00,131.00,-2.00
5,Api Finance Limited,3,156.00,156.00,156.00,70.00,10920.00,159.00,-3.00
6,Arun Valley Hydropower Development Co. Ltd.,25,420.00,413.00,414.00,962.00,400045.00,420.00,-6.00
7,Asian Life Insurance Co. Limited,35,214.00,208.00,208.00,1750.00,365880.00,218.00,-10.00
8,Axis Development Bank Limited,4,132.00,132.00,132.00,160.00,21120.00,134.00,-2.00
9,Bank of Asia Nepal Limited,16,173.00,161.00,170.00,5560.00,907940.00,176.00,-6.00
10,Bank of Kathmandu Ltd.,29,516.00,508.00,514.00,4765.00,2447592.00,514.00,0.00
11,Biratlaxmi Bikas Bank Limited,3,143.00,141.00,141.00,365.00,51865.00,145.00,-4.00
12,Chilime Hydropower Company Limited,6,934.00,930.00,934.00,1350.00,1259300.00,934.00,0.00
13,Citizen Bank International Limited,24,204.00,194.00,200.00,3060.00,599170.00,200.00,0.00
14,Clean Energy Development Bank Limited,5,203.00,196.00,196.00,402.00,80212.00,203.00,-7.00
15,Crystal Finance Ltd.,29,215.00,211.00,211.00,540.00,116060.00,215.00,-4.00
16,Deprosc Laghubitta Bittiya Sanstha Limited,7,358.00,332.00,358.00,140.00,48460.00,326.00,32.00
17,Everest Bank Limited,6,989.00,951.00,989.00,97.00,94013.00,959.00,30.00
18,Gandaki Bikas Bank Limited,108,124.00,118.00,118.00,4310.00,524330.00,123.00,-5.00
19,Gandaki Bikas BankLimited,2,182.00,179.00,179.00,370.00,66380.00,185.00,-6.00
20,Garima Bikas Bank Limited,61,137.00,130.00,134.00,1660.00,220640.00,139.00,-5.00
21,Gaurishankar Development Bank Ltd.,63,134.00,132.00,132.00,670.00,88680.00,132.00,0.00
22,Global IME Bank Limited,16,190.00,184.00,185.00,1925.00,357830.00,190.00,-5.00
23,Grand Bank Nepal Limited,6,158.00,155.00,155.00,887.00,139035.00,160.00,-5.00
24,Himalayan Bank Limited,2,539.00,529.00,529.00,71.00,37759.00,529.00,0.00
25,ICFC Finance Limited,17,195.00,183.00,186.00,1362.00,255468.00,196.00,-10.00
26,Infrastructure Development Bank Ltd.,1,123.00,123.00,123.00,10.00,1230.00,121.00,2.00
27,Jyoti Bikas Bank Limited,180,107.00,103.00,105.00,4220.00,442730.00,104.00,1.00
28,Kabeli Bikas Bank Limited,15,236.00,216.00,216.00,190.00,42880.00,240.00,-24.00
29,Kankai Bikas Bank Ltd.,27,110.00,106.00,106.00,310.00,33200.00,112.00,-6.00
30,Karnali Development Bank Limited,6,128.00,118.00,118.00,60.00,7380.00,130.00,-12.00
31,Kasthamandap Development Bank Limited,1,113.00,113.00,113.00,30.00,3390.00,129.00,-16.00
32,Kumari Bank Limited,11,258.00,234.00,234.00,809.00,195685.00,249.00,-15.00
33,Kumari Bank Limited Promotor Share,35,113.00,106.00,107.00,550.00,59810.00,110.00,-3.00
34,Life Insurance Co. Nepal,3,607.00,606.00,606.00,200.00,121300.00,618.00,-12.00
35,Lumbini Bank Limited,7,207.00,201.00,207.00,527.00,107551.00,200.00,7.00
36,Lumbini Bikas Bank Ltd.,5,155.00,149.00,149.00,330.00,49960.00,152.00,-3.00
37,Mahakali Bikas Bank Limited,3,138.00,138.00,138.00,30.00,4140.00,140.00,-2.00
38,Mahalaxmi Bikas Bank Ltd.,65,103.00,100.00,100.00,3080.00,311580.00,102.00,-2.00
39,Nabil Bank Limited,16,1076.00,1030.00,1040.00,1340.00,1394926.00,1097.00,-57.00
40,Narayani National Finance Company Limited Promoter Share,1,118.00,118.00,118.00,22078.00,2605204.00,119.00,-1.00
41,National Hydro Power Company Limited,2,40.00,40.00,40.00,2000.00,80000.00,40.00,0.00
42,National Life Insurance Co. Ltd.,2,290.00,290.00,290.00,158.00,45820.00,295.00,-5.00
43,Nepal Aawas Finance Limited,3,232.00,232.00,232.00,534.00,123888.00,236.00,-4.00
44,Nepal Bangladesh Bank Limited,6,143.00,134.00,143.00,350.00,47680.00,136.00,7.00
45,Nepal Doorsanchar Comapany Limited,14,450.00,436.00,450.00,2460.00,1097260.00,440.00,10.00
46,Nepal Housing & Merchant Finance Ltd.,5,210.00,210.00,210.00,945.00,198450.00,211.00,-1.00
47,Nepal Investment Bank Limited,3,555.00,547.00,555.00,344.00,190498.00,545.00,10.00
48,Nepal SBI Bank Limited,6,510.00,500.00,505.00,532.00,267155.00,491.00,14.00
49,NIC Asia Bank Ltd.,25,465.00,441.00,465.00,3578.00,1601802.00,450.00,15.00
50,Nilgiri Bikas Bank Limited,13,135.00,133.00,135.00,220.00,29340.00,133.00,2.00
51,NMB Bank Limited,3,235.00,228.00,235.00,250.00,57260.00,232.00,3.00
52,Om Development Bank Ltd.,40,184.00,179.00,182.00,810.00,146690.00,185.00,-3.00
53,Prabhu  Bank Limited,3,151.00,148.00,148.00,300.00,44700.00,154.00,-6.00
54,Prime Commercial Bank Ltd.,11,212.00,210.00,210.00,1178.00,247969.00,206.00,4.00
55,Prime Life Insurance Company Limited,7,183.00,180.00,180.00,230.00,41460.00,180.00,0.00
56,Public Development Bank Limited,8,98.00,97.00,97.00,330.00,32240.00,99.00,-2.00
57,Reliable Development Bank Limited,3,209.00,205.00,209.00,250.00,51450.00,207.00,2.00
58,Sagarmatha  Finance Limited,4,159.00,154.00,154.00,325.00,51100.00,162.00,-8.00
59,Sahayogi Bikas Bank Limited,1,270.00,270.00,270.00,59.00,15930.00,270.00,0.00
60,Sewa Bikas Bank Limited,6,138.00,128.00,128.00,60.00,7980.00,140.00,-12.00
61,Siddhartha Bank Limited,13,247.00,228.00,247.00,1097.00,257394.00,243.00,4.00
62,Siddhartha Development Bank Ltd.,1,135.00,135.00,135.00,200.00,27000.00,137.00,-2.00
63,Soaltee Hotel Limited,1,225.00,225.00,225.00,123.00,27675.00,225.00,0.00
64,Standard Chartered Bank Limited,16,1581.00,1521.00,1581.00,743.00,1142522.00,1570.00,11.00
65,Subha Laxmi Finance Co. Ltd.,80,108.00,104.00,104.00,1600.00,171740.00,103.00,1.00
66,Sunrise Bank Limited,88,162.00,150.00,158.00,8304.00,1285386.00,155.00,3.00
67,Surya Life Insurance Company Limited,71,143.00,140.00,141.00,2140.00,305010.00,141.00,0.00
68,Suryadarshan Finance Company Limited,12,116.00,113.00,116.00,160.00,18380.00,118.00,-2.00
69,Swastik Merchant Finance Co. Ltd.,50,108.00,102.00,104.00,840.00,89410.00,107.00,-3.00
70,Taragaon Regency Hotel Limited,1,85.00,85.00,85.00,60.00,5100.00,85.00,0.00
71,Tinau Development Bank Limited,4,297.00,282.00,282.00,40.00,11580.00,303.00,-21.00
72,Triveni Bikas Bank Limited,1,194.00,194.00,194.00,27.00,5238.00,194.00,0.00
73,Udhyam Bikas Bank Limited,18,110.00,105.00,107.00,240.00,25800.00,111.00,-4.00
74,Unique Finance Ltd.,15,108.00,105.00,105.00,670.00,71510.00,108.00,-3.00
75,Valley Finance Limited,171,141.00,133.00,135.00,2570.00,349310.00,143.00,-8.00
76,Zenith Finance Limited,17,138.00,136.00,136.00,480.00,65424.00,135.00,1.00
