S.N.,Traded Companies,No. Of Transaction,Max Price,Min Price,Closing Price,Traded Shares,Amount,Previous Closing,Difference Rs.
1,Agriculture Development Bank Limited,22,121.00,119.00,119.00,1934.00,231304.00,121.00,-2.00
2,Alpine Development Bank Limited,5,97.00,95.00,97.00,90.00,8630.00,96.00,1.00
3,Api Finance Limited,19,125.00,123.00,123.00,260.00,32100.00,127.00,-4.00
4,Araniko Development Bank Limited,10,171.00,168.00,168.00,260.00,43770.00,174.00,-6.00
5,Arun Valley Hydropower Development Co. Ltd.,16,325.00,320.00,325.00,724.00,233871.00,318.00,7.00
6,Asian Life Insurance Co. Limited,20,145.00,141.00,142.00,840.00,120630.00,145.00,-3.00
7,Bank of Asia Nepal Limited,17,170.00,159.00,163.00,1887.00,308825.00,168.00,-5.00
8,Bank of Kathmandu Ltd.,144,541.00,529.00,531.00,26525.00,14143700.00,546.00,-15.00
9,Bhrikuti Vikash Bank Limited,1,231.00,231.00,231.00,20.00,4620.00,227.00,4.00
10,Biratlaxmi Bikas Bank Limited,1,128.00,128.00,128.00,20.00,2560.00,130.00,-2.00
11,Business Universal Development Bank Ltd.,2,146.00,144.00,146.00,100.00,14440.00,142.00,4.00
12,Chilime Hydropower Company Limited,4,828.00,820.00,828.00,550.00,452300.00,835.00,-7.00
13,Citizen Bank International Limited,27,175.00,161.00,173.00,2910.00,488450.00,175.00,-2.00
14,City Express Finance Co. Limited,45,110.00,110.00,110.00,1770.00,194700.00,112.00,-2.00
15,Clean Energy Development Bank Limited,10,146.00,144.00,144.00,632.00,91282.00,146.00,-2.00
16,Deva Bikas Bank Limited,16,92.00,88.00,89.00,1490.00,133757.00,93.00,-4.00
17,Everest Bank Limited,19,960.00,910.00,960.00,874.00,806468.00,920.00,40.00
18,Fewa Finance Co. Ltd.,4,218.00,206.00,206.00,217.00,46078.00,221.00,-15.00
19,Gandaki Bikas Bank Limited,164,107.00,105.00,107.00,3600.00,382570.00,106.00,1.00
20,Garima Bikas Bank Limited,82,137.00,129.00,134.00,2270.00,304790.00,137.00,-3.00
21,Gaurishankar Development Bank Ltd.,9,98.00,97.00,98.00,90.00,8760.00,100.00,-2.00
22,Global IME Bank Limited,9,177.00,174.00,175.00,380.00,66575.00,177.00,-2.00
23,Gorkha Finance Ltd.,1,96.00,96.00,96.00,116.00,11136.00,96.00,0.00
24,Grand Bank Nepal Limited,8,132.00,128.00,132.00,437.00,56746.00,130.00,2.00
25,Guheshowori Merchant Bank & Finance Co. Ltd.,1,338.00,338.00,338.00,20.00,6760.00,344.00,-6.00
26,Gurans Life Insurance Company Ltd.,2,180.00,180.00,180.00,20.00,3600.00,183.00,-3.00
27,Gurkhas Finance Ltd.,2,136.00,134.00,134.00,409.00,54988.00,136.00,-2.00
28,Himalayan Bank Limited,5,590.00,580.00,580.00,378.00,221477.00,602.00,-22.00
29,Himalayan Finance Limited (Bittiya Sanstha),1,72.00,72.00,72.00,30.00,2160.00,72.00,0.00
30,ICFC Finance Limited Promotor Share,4,116.00,116.00,116.00,35854.00,4159064.00,116.00,0.00
31,IME Financial Institution Promoter Share,1,246.00,246.00,246.00,25000.00,6150000.00,242.00,4.00
32,Janaki Finance Ltd.,2,225.00,224.00,225.00,232.00,52174.00,222.00,3.00
33,Jyoti Bikas Bank Limited,31,94.00,92.00,94.00,1550.00,144800.00,93.00,1.00
34,Kamana Sewa Bikas Bank Limited,177,113.00,104.00,106.00,4810.00,509390.00,115.00,-9.00
35,Karnali Development Bank Limited,33,71.00,71.00,71.00,570.00,40470.00,70.00,1.00
36,Kumari Bank Limited,6,233.00,228.00,233.00,163.00,37552.00,227.00,6.00
37,Kumari Bank Limited Promotor Share,7,85.00,84.00,84.00,70.00,5890.00,85.00,-1.00
38,Laxmi Bank Limited,1,260.00,260.00,260.00,50.00,13000.00,265.00,-5.00
39,Lord Buddha Finance Limited,1,138.00,138.00,138.00,18.00,2484.00,136.00,2.00
40,Lumbini Bank Limited,11,207.00,201.00,203.00,2351.00,477965.00,203.00,0.00
41,Lumbini Bikas Bank Ltd.,49,113.00,108.00,108.00,1130.00,123960.00,110.00,-2.00
42,Lumbini General Insurance Co. Ltd.,1,119.00,119.00,119.00,10.00,1190.00,121.00,-2.00
43,Machhapuchhre Bank Limited,9,108.00,104.00,107.00,1569.00,166413.00,102.00,5.00
44,Mahalaxmi Bikas Bank Ltd.,32,81.00,79.00,79.00,1320.00,104780.00,80.00,-1.00
45,Mahalaxmi BikasBank Limited,3,140.00,140.00,140.00,220.00,30800.00,138.00,2.00
46,Miteri Development Bank Limited,11,102.00,100.00,102.00,360.00,36280.00,102.00,0.00
47,Nabil Bank Limited,7,899.00,875.00,897.00,451.00,397532.00,885.00,12.00
48,National Hydro Power Company Limited,11,49.50,48.00,48.92,22400.00,1087109.00,48.00,0.92
49,National Life Insurance Co. Ltd.,5,362.00,342.00,342.00,335.00,117150.00,369.00,-27.00
50,Nepal Bangladesh Bank Limited,1,121.00,121.00,121.00,625.00,75625.00,123.00,-2.00
51,Nepal Credit And Commercial Bank Limited,12,120.00,114.00,117.00,2690.00,318360.00,122.00,-5.00
52,Nepal Doorsanchar Comapany Limited,7,411.00,405.00,409.00,1350.00,548550.00,411.00,-2.00
53,Nepal Finance Ltd.,1,158.00,158.00,158.00,27.00,4266.00,155.00,3.00
54,Nepal Investment Bank Limited,8,500.00,481.00,481.00,681.00,330945.00,500.00,-19.00
55,Nepal SBI Bank Limited,6,505.00,495.00,495.00,1153.00,577285.00,505.00,-10.00
56,Nerude Laghubita Bikas Bank Limited,4,503.00,493.00,493.00,320.00,159500.00,494.00,-1.00
57,NIC Asia Bank Ltd.,22,472.00,462.00,470.00,2640.00,1234656.00,476.00,-6.00
58,NIDC Capital Markets Ltd.,1,196.00,196.00,196.00,100.00,19600.00,200.00,-4.00
59,Nilgiri Bikas Bank Limited,6,115.00,114.00,114.00,120.00,13710.00,114.00,0.00
60,NMB Bank Limited,4,177.00,173.00,177.00,204.00,35796.00,174.00,3.00
61,Om Development Bank Ltd.,15,148.00,146.00,146.00,570.00,83340.00,148.00,-2.00
62,Patan Finance Limited,1,100.00,100.00,100.00,440.00,44000.00,102.00,-2.00
63,Prabhu  Bank Limited,4,155.00,147.00,147.00,155.00,22935.00,157.00,-10.00
64,Prime Commercial Bank Ltd.,33,205.00,191.00,193.00,2727.00,535415.00,203.00,-10.00
65,Prime Life Insurance Company Limited,14,144.00,141.00,141.00,590.00,84430.00,144.00,-3.00
66,Public Development Bank Limited,14,70.00,69.00,69.00,200.00,13850.00,71.00,-2.00
67,Rastriya Beema Company Limited,8,159.00,156.00,156.00,252.00,39858.00,157.00,-1.00
68,Reliable Development Bank Limited,8,152.00,148.00,148.00,508.00,76166.00,155.00,-7.00
69,Sahayogi Bikas Bank Limited,10,262.00,257.00,257.00,264.00,67926.00,263.00,-6.00
70,Sewa Bikas Bank Limited,3,115.00,114.00,114.00,157.00,18032.00,115.00,-1.00
71,Siddhartha Bank Limited,3,225.00,224.00,224.00,412.00,92588.00,228.00,-4.00
72,Siddhartha Development Bank Ltd.,1,108.00,108.00,108.00,350.00,37800.00,109.00,-1.00
73,Standard Chartered Bank Limited,10,1484.00,1455.00,1460.00,724.00,1056377.00,1480.00,-20.00
74,Standard Finance Ltd.,1,99.00,99.00,99.00,300.00,29700.00,98.00,1.00
75,Subha Laxmi Finance Co. Ltd.,47,107.00,105.00,105.00,940.00,99540.00,107.00,-2.00
76,Sunrise Bank Limited,21,140.00,134.00,136.00,971.00,132811.00,140.00,-4.00
77,Surya Life Insurance Company Limited,8,117.00,115.00,117.00,240.00,28020.00,117.00,0.00
78,Swabalamban Laghubitta Bittiya Sanstha Limited,3,220.00,218.00,220.00,639.00,139522.00,214.00,6.00
79,Taragaon Regency Hotel Limited,3,91.00,90.00,91.00,490.00,44210.00,91.00,0.00
80,Tinau Development Bank Limited,39,98.00,97.00,97.00,520.00,50760.00,100.00,-3.00
81,Triveni Bikas Bank Limited,1,167.00,167.00,167.00,27.00,4509.00,169.00,-2.00
82,Udhyam Bikas Bank Limited,6,90.00,86.00,86.00,260.00,23060.00,89.00,-3.00
83,Unique Finance Ltd.,139,101.00,97.00,97.00,3410.00,331920.00,102.00,-5.00
84,United Insurance Co. (Nepal) Ltd.,1,290.00,290.00,290.00,12.00,3480.00,295.00,-5.00
85,Valley Finance Limited,62,110.00,108.00,110.00,670.00,73380.00,108.00,2.00
86,Zenith Finance Limited,23,104.00,100.00,104.00,582.00,58596.00,101.00,3.00
