S.N.,Traded Companies,No. Of Transaction,Max Price,Min Price,Closing Price,Traded Shares,Amount,Previous Closing,Difference Rs.
1,Agriculture Development Bank Limited,16,117.00,117.00,117.00,820.00,95940.00,116.00,1.00
2,Api Finance Limited,8,127.00,124.00,125.00,1160.00,145040.00,128.00,-3.00
3,Araniko Development Bank Limited,288,83.00,79.00,81.00,7360.00,595410.00,83.00,-2.00
4,Arun Valley Hydropower Development Co. Ltd.,25,343.00,337.00,343.00,1076.00,365881.00,340.00,3.00
5,Asian Life Insurance Co. Limited,21,171.00,168.00,169.00,1410.00,239420.00,169.00,0.00
6,Bank of Asia Nepal Limited,7,171.00,168.00,168.00,260.00,44100.00,169.00,-1.00
7,Bank of Kathmandu Ltd.,50,430.00,419.00,425.00,12346.00,5218130.00,431.00,-6.00
8,Best Finance Company Ltd.,2,485.00,485.00,485.00,484.00,234740.00,483.00,2.00
9,Biratlaxmi Bikas Bank Limited,4,154.00,150.00,150.00,329.00,49691.00,153.00,-3.00
10,Butwal Power Company Limited,1,549.00,549.00,549.00,50.00,27450.00,539.00,10.00
11,Chilime Hydropower Company Limited,38,949.00,881.00,940.00,8170.00,7534250.00,864.00,76.00
12,Citizen Bank International Limited,12,168.00,163.00,168.00,1670.00,276320.00,164.00,4.00
13,Civil Merchant Bittiya Santha Ltd.,26,118.00,108.00,118.00,4890.00,531500.00,118.00,0.00
14,Clean Energy Development Bank Limited,6,145.00,144.00,145.00,924.00,133788.00,143.00,2.00
15,Deva Bikas Bank Limited,27,98.00,93.00,93.00,3446.00,325828.00,99.00,-6.00
16,Everest Bank Limited,20,891.00,840.00,867.00,611.00,518834.00,909.00,-42.00
17,Everest Insurance Co. Ltd.,4,315.00,310.00,315.00,177.00,55085.00,310.00,5.00
18,Gandaki Bikas Bank Limited,1,107.00,107.00,107.00,160.00,17120.00,107.00,0.00
19,Gandaki Bikas BankLimited,1,149.00,149.00,149.00,200.00,29800.00,147.00,2.00
20,Garima Bikas Bank Limited,1,136.00,136.00,136.00,40.00,5440.00,137.00,-1.00
21,Global IME Bank Limited,9,161.00,155.00,155.00,1495.00,233195.00,155.00,0.00
22,Grand Bank Nepal Limited,11,136.00,132.00,132.00,3764.00,500707.00,138.00,-6.00
23,Hathway Finance Company Limited,134,63.00,58.00,58.00,5380.00,329040.00,64.00,-6.00
24,Himalayan Bank Limited,5,599.00,580.00,580.00,277.00,161521.00,588.00,-8.00
25,Himalayan Finance Limited (Bittiya Sanstha),14,73.00,69.00,73.00,260.00,18220.00,70.00,3.00
26,ICFC Finance Limited,16,146.00,146.00,146.00,1408.00,205568.00,146.00,0.00
27,IME Financial Institution,1,236.00,236.00,236.00,100.00,23600.00,240.00,-4.00
28,Jyoti Bikas Bank Limited,10,99.00,97.00,97.00,100.00,9790.00,99.00,-2.00
29,Kamana Sewa Bikas Bank Limited,129,110.00,108.00,110.00,3130.00,342530.00,109.00,1.00
30,Karnali Development Bank Limited,2,75.00,75.00,75.00,30.00,2250.00,76.00,-1.00
31,Kumari Bank Limited,6,220.00,212.00,216.00,1110.00,238560.00,216.00,0.00
32,Kumari Bank Limited Promotor Share,29,96.00,96.00,96.00,300.00,28800.00,97.00,-1.00
33,Laxmi Bank Limited,7,269.00,260.00,269.00,1833.00,479927.00,260.00,9.00
34,Life Insurance Co. Nepal,2,559.00,549.00,559.00,40.00,22260.00,560.00,-1.00
35,Lumbini Bank Limited,7,205.00,201.00,205.00,1107.00,224237.00,201.00,4.00
36,Lumbini Bikas Bank Ltd.,19,116.00,114.00,115.00,4390.00,504270.00,115.00,0.00
37,Lumbini Finance Ltd.,1,129.00,129.00,129.00,89.00,11481.00,131.00,-2.00
38,Machhapuchhre Bank Limited,10,112.00,110.00,111.00,4439.00,491841.00,108.00,3.00
39,Mahalaxmi Bikas Bank Ltd.,14,79.00,78.00,79.00,540.00,42160.00,80.00,-1.00
40,Miteri Development Bank Limited,2,101.00,101.00,101.00,80.00,8080.00,101.00,0.00
41,Nabil Bank Limited,6,960.00,927.00,931.00,403.00,378670.00,950.00,-19.00
42,Narayani National Finance Limited,1,134.00,134.00,134.00,735.00,98490.00,135.00,-1.00
43,National Hydro Power Company Limited,13,65.00,64.00,65.00,15300.00,987500.00,63.00,2.00
44,Nepal Bangladesh Bank Limited,4,118.00,117.00,118.00,590.00,69340.00,116.00,2.00
45,Nepal Investment Bank Limited,40,577.00,557.00,565.00,3942.00,2224036.00,568.00,-3.00
46,Nepal SBI Bank Limited,3,500.00,490.00,490.00,182.00,89530.00,491.00,-1.00
47,Nerude Laghubita Bikas Bank Limited,2,553.00,543.00,553.00,190.00,103270.00,554.00,-1.00
48,NIC Asia Bank Ltd.,13,444.00,438.00,440.00,949.00,417210.00,441.00,-1.00
49,Nilgiri Bikas Bank Limited,5,119.00,118.00,119.00,160.00,19000.00,119.00,0.00
50,NMB Bank Limited,8,169.00,160.00,163.00,1819.00,297611.00,166.00,-3.00
51,Om Development Bank Ltd.,10,151.00,147.00,150.00,300.00,44720.00,145.00,5.00
52,Oriental Hotels Limited,8,66.00,62.00,62.00,690.00,44030.00,67.00,-5.00
53,Prabhu  Bank Limited,15,155.00,143.00,155.00,7250.00,1107710.00,141.00,14.00
54,Prime Commercial Bank Ltd.,16,198.00,192.00,197.00,2438.00,473114.00,195.00,2.00
55,Prime Life Insurance Company Limited,3,164.00,161.00,164.00,160.00,26120.00,164.00,0.00
56,ProgressiveFinance Limited,1,131.00,131.00,131.00,3890.00,509590.00,133.00,-2.00
57,Reliable Development Bank Limited,7,153.00,149.00,149.00,228.00,34500.00,150.00,-1.00
58,Resunga Bikas Bank Limited,9,196.00,190.00,190.00,610.00,116260.00,199.00,-9.00
59,Sagarmatha  Finance Limited,9,132.00,128.00,132.00,363.00,47534.00,126.00,6.00
60,Sagarmatha Insurance Co. Ltd.,1,346.00,346.00,346.00,75.00,25950.00,345.00,1.00
61,Sewa Bikas Bank Limited,11,119.00,114.00,115.00,334.00,38887.00,121.00,-6.00
62,Siddharth Finance Ltd.,1,149.00,149.00,149.00,124.00,18476.00,149.00,0.00
63,Siddhartha Bank Limited,5,243.00,235.00,238.00,777.00,184615.00,231.00,7.00
64,Standard Chartered Bank Limited,11,1465.00,1435.00,1440.00,648.00,932858.00,1450.00,-10.00
65,Standard Finance Ltd.,2,95.00,94.00,94.00,520.00,48890.00,100.00,-6.00
66,Subha Laxmi Finance Co. Ltd.,6,109.00,107.00,108.00,120.00,13000.00,106.00,2.00
67,Subhechha Bikas Bank Limited,33,120.00,116.00,119.00,1059.00,124486.00,116.00,3.00
68,Sunrise Bank Limited,21,143.00,139.00,140.00,1477.00,207540.00,140.00,0.00
69,Surya Life Insurance Company Limited,15,117.00,115.00,117.00,450.00,52140.00,116.00,1.00
70,Swabalamban Laghubitta Bittiya Sanstha Limited,6,215.00,210.00,215.00,2027.00,430914.00,214.00,1.00
71,United Finance Ltd.,4,137.00,134.00,137.00,579.00,78108.00,132.00,5.00
72,Zenith Finance Limited,6,106.00,104.00,106.00,92.00,9704.00,108.00,-2.00
