S.N.,Traded Companies,No. Of Transaction,Max Price,Min Price,Closing Price,Traded Shares,Amount,Previous Closing,Difference Rs.
1,Agriculture Development Bank Limited,53,140.00,138.00,138.00,3867.00,540098.00,141.00,-3.00
2,Alpine Development Bank Limited,6,160.00,158.00,158.00,120.00,19080.00,161.00,-3.00
3,Api Finance Limited,3,215.00,215.00,215.00,30.00,6450.00,218.00,-3.00
4,Arun Valley Hydropower Development Co. Ltd.,4,450.00,445.00,447.00,158.00,70494.00,450.00,-3.00
5,Asian Life Insurance Co. Limited,16,257.00,255.00,256.00,830.00,212150.00,259.00,-3.00
6,Axis Development Bank Limited,19,148.00,134.00,146.00,735.00,106910.00,136.00,10.00
7,Bank of Asia Nepal Limited,11,264.00,259.00,259.00,1990.00,517820.00,258.00,1.00
8,Bank of Kathmandu Ltd.,18,581.00,575.00,575.00,1640.00,945066.00,571.00,4.00
9,Business Universal Development Bank Ltd.,1,144.00,144.00,144.00,328.00,47232.00,146.00,-2.00
10,Capital Merchant Bank & Finance Co. Ltd.,1,151.00,151.00,151.00,10.00,1510.00,144.00,7.00
11,Chilime Hydropower Company Limited,2,960.00,953.00,960.00,650.00,620850.00,970.00,-10.00
12,Citizen Bank International Limited,13,253.00,250.00,250.00,790.00,197850.00,248.00,2.00
13,City Express Finance Co. Limited,4,120.00,118.00,118.00,450.00,53430.00,122.00,-4.00
14,Civil Merchant Bittiya Santha Ltd.,40,240.00,230.00,240.00,530.00,122580.00,226.00,14.00
15,Clean Energy Development Bank Limited,7,233.00,233.00,233.00,420.00,97860.00,229.00,4.00
16,Crystal Finance Ltd.,14,230.00,225.00,225.00,190.00,43370.00,230.00,-5.00
17,Everest Bank Limited,2,1100.00,1079.00,1100.00,20.00,21790.00,1079.00,21.00
18,Gaurishankar Development Bank Ltd.,71,167.00,158.00,158.00,710.00,112360.00,175.00,-17.00
19,Global IME Bank Limited,6,224.00,221.00,221.00,370.00,82565.00,227.00,-6.00
20,Grand Bank Nepal Limited,3,196.00,195.00,196.00,352.00,68710.00,198.00,-2.00
21,Gurkha Development Bank Limited,28,248.00,232.00,248.00,1984.00,471412.00,236.00,12.00
22,Himalayan Bank Limited,1,605.00,605.00,605.00,92.00,55660.00,600.00,5.00
23,Infrastructure Development Bank Ltd.,1,159.00,159.00,159.00,10.00,1590.00,156.00,3.00
24,Kaski Finance Limited,2,217.00,217.00,217.00,150.00,32550.00,221.00,-4.00
25,Kasthamandap Development Bank Limited,27,167.00,164.00,167.00,920.00,153440.00,165.00,2.00
26,Kumari Bank Limited,3,305.00,301.00,305.00,160.00,48560.00,296.00,9.00
27,Lalitpur Finance Ltd.,1,318.00,318.00,318.00,25.00,7950.00,312.00,6.00
28,Laxmi Bank Limited,9,474.00,460.00,474.00,700.00,326202.00,469.00,5.00
29,Lumbini Bank Limited,1,224.00,224.00,224.00,200.00,44800.00,225.00,-1.00
30,Lumbini Bikas Bank Ltd.,25,195.00,192.00,192.00,660.00,127890.00,193.00,-1.00
31,Machhapuchhre Bank Limited,7,202.00,200.00,201.00,1007.00,202485.00,205.00,-4.00
32,Mahalaxmi Bikas Bank Ltd.,86,120.00,116.00,120.00,4250.00,498900.00,116.00,4.00
33,Nabil Bank Limited,2,1350.00,1330.00,1330.00,24.00,32120.00,1325.00,5.00
34,National Hydro Power Company Limited,16,50.69,45.00,50.69,9400.00,437831.00,48.75,1.94
35,National Life Insurance Co. Ltd.,6,353.00,353.00,353.00,14920.00,5266760.00,360.00,-7.00
36,Neco Insurance Co. Ltd.,1,118.00,118.00,118.00,8152.00,961936.00,118.00,0.00
37,Nepal Credit And Commercial Bank Limited,1,211.00,211.00,211.00,20.00,4220.00,208.00,3.00
38,Nepal Doorsanchar Comapany Limited,1,443.00,443.00,443.00,300.00,132900.00,442.00,1.00
39,Nepal Investment Bank Limited,8,630.00,612.00,630.00,624.00,384312.00,610.00,20.00
40,Nepal Life Insurance Co. Ltd.,3,730.00,730.00,730.00,105.00,76650.00,730.00,0.00
41,Nepal SBI Bank Limited,8,591.00,580.00,580.00,1030.00,601670.00,585.00,-5.00
42,Nerude Laghubita Bikas Bank Limited,2,407.00,407.00,407.00,120.00,48840.00,400.00,7.00
43,NIC Asia Bank Ltd.,4,520.00,515.00,515.00,348.00,179549.00,510.00,5.00
44,NIDC Capital Markets Ltd.,3,423.00,415.00,423.00,619.00,258637.00,418.00,5.00
45,Nilgiri Bikas Bank Limited,10,159.00,158.00,159.00,170.00,26940.00,155.00,4.00
46,NMB Bank Limited,5,265.00,255.00,263.00,666.00,173178.00,256.00,7.00
47,Om Development Bank Ltd.,100,225.00,222.00,224.00,1980.00,441880.00,222.00,2.00
48,Pathibhara Bikas Bank Limited,2,131.00,129.00,129.00,40.00,5200.00,133.00,-4.00
49,Prabhu  Bank Limited,1,178.00,178.00,178.00,460.00,81880.00,175.00,3.00
50,Prime Commercial Bank Ltd.,17,270.00,263.00,263.00,1350.00,362227.00,270.00,-7.00
51,Prime Life Insurance Company Limited,36,204.00,200.00,200.00,1260.00,255950.00,201.00,-1.00
52,Public Development Bank Limited,14,116.00,116.00,116.00,340.00,39440.00,116.00,0.00
53,Sahayogi Bikas Bank Limited,1,262.00,262.00,262.00,200.00,52400.00,260.00,2.00
54,Samriddhi Finance Company Limited,21,124.00,121.00,121.00,4006.00,490694.00,125.00,-4.00
55,Sewa Bikas Bank Limited,128,150.00,148.00,150.00,1760.00,263810.00,152.00,-2.00
56,Shree Investment Finance Co. Ltd.,1,458.00,458.00,458.00,38.00,17404.00,467.00,-9.00
57,Siddhartha Bank Limited,7,307.00,296.00,307.00,560.00,166550.00,298.00,9.00
58,Siddhartha Insurance Ltd.,3,124.00,122.00,122.00,930.00,114510.00,124.00,-2.00
59,Soaltee Hotel Limited,9,241.00,235.00,239.00,17198.00,4081021.00,241.00,-2.00
60,Standard Chartered Bank Limited,9,2025.00,1985.00,2025.00,636.00,1266000.00,1970.00,55.00
61,Standard Finance Ltd.,1,148.00,148.00,148.00,500.00,74000.00,146.00,2.00
62,Sunrise Bank Limited,28,221.00,216.00,219.00,1591.00,347086.00,220.00,-1.00
63,Supreme Development Bank Ltd.,8,118.00,116.00,118.00,1884.00,218968.00,120.00,-2.00
64,Surya Life Insurance Company Limited,28,155.00,152.00,155.00,1760.00,269000.00,152.00,3.00
65,Suryadarshan Finance Company Limited,17,154.00,152.00,152.00,220.00,33660.00,156.00,-4.00
66,Swabalamban Laghubitta Bittiya Sanstha Limited,4,273.00,270.00,273.00,133.00,36071.00,275.00,-2.00
67,Swastik Merchant Finance Co. Ltd.,31,137.00,136.00,136.00,350.00,47660.00,136.00,0.00
68,Triveni Bikas Bank Limited,2,196.00,196.00,196.00,89.00,17444.00,197.00,-1.00
69,Udhyam Bikas Bank Limited,10,190.00,181.00,181.00,130.00,23920.00,200.00,-19.00
70,Unique Finance Ltd.,140,160.00,157.00,157.00,2100.00,333390.00,160.00,-3.00
71,United Finance Ltd.,5,204.00,200.00,204.00,310.00,62248.00,200.00,4.00
