S.N.,Traded Companies,No. Of Transaction,Max Price,Min Price,Closing Price,Traded Shares,Amount,Previous Closing,Difference Rs.
1,Ace Development Bank Ltd.,3,128.00,126.00,127.00,741.00,94256.00,130.00,-3.00
2,Agriculture Development Bank Limited,40,119.00,116.00,118.00,3345.00,391615.00,118.00,0.00
3,Alpine Development Bank Limited,1,103.00,103.00,103.00,10.00,1030.00,105.00,-2.00
4,Api Finance Limited,8,132.00,128.00,130.00,310.00,40280.00,130.00,0.00
5,Araniko Development Bank Limited,74,94.00,87.00,87.00,1610.00,142090.00,96.00,-9.00
6,Arun Valley Hydropower Development Co. Ltd.,6,348.00,340.00,345.00,317.00,109460.00,340.00,5.00
7,Asian Life Insurance Co. Limited,122,176.00,174.00,175.00,5520.00,960760.00,171.00,4.00
8,Axis Development Bank Limited,26,89.00,83.00,83.00,1635.00,138865.00,90.00,-7.00
9,Bank of Asia Nepal Limited,12,178.00,170.00,175.00,1175.00,202942.00,173.00,2.00
10,Bank of Kathmandu Ltd.,8,455.00,445.00,450.00,1420.00,634667.00,453.00,-3.00
11,Chilime Hydropower Company Limited,3,820.00,816.00,820.00,410.00,335400.00,815.00,5.00
12,Citizen Bank International Limited,2,170.00,169.00,170.00,80.00,13580.00,170.00,0.00
13,City Express Finance Co. Limited,4,112.00,108.00,108.00,140.00,15220.00,114.00,-6.00
14,Civil Merchant Bittiya Santha Ltd.,1,116.00,116.00,116.00,40.00,4640.00,116.00,0.00
15,Clean Energy Development Bank Limited,7,150.00,147.00,150.00,204.00,30218.00,150.00,0.00
16,CMB Finance Limited,2,123.00,121.00,121.00,86.00,10458.00,125.00,-4.00
17,Deva Bikas Bank Limited,7,98.00,95.00,98.00,187.00,17918.00,94.00,4.00
18,Everest Bank Limited,1,930.00,930.00,930.00,10.00,9300.00,915.00,15.00
19,Everest Finance Ltd.,2,161.00,158.00,158.00,100.00,15920.00,164.00,-6.00
20,Gandaki Bikas Bank Limited,106,108.00,107.00,108.00,2180.00,234120.00,108.00,0.00
21,Garima Bikas Bank Limited,66,139.00,137.00,139.00,1610.00,220770.00,138.00,1.00
22,Gaurishankar Development Bank Ltd.,13,100.00,97.00,97.00,180.00,17650.00,100.00,-3.00
23,Global IME Bank Limited,8,162.00,159.00,159.00,370.00,59165.00,176.00,-17.00
24,Grand Bank Nepal Limited,11,136.00,133.00,134.00,1641.00,219894.00,134.00,0.00
25,Gurans Life Insurance Company Ltd.,3,158.00,152.00,152.00,30.00,4650.00,166.00,-14.00
26,Hathway Finance Company Limited,80,66.00,66.00,66.00,3200.00,211200.00,66.00,0.00
27,Himalayan Bank Limited,2,595.00,590.00,595.00,216.00,127800.00,591.00,4.00
28,Himalayan Finance Limited (Bittiya Sanstha),85,66.00,63.00,64.00,1440.00,93450.00,63.00,1.00
29,IME Financial Institution,1,240.00,240.00,240.00,40.00,9600.00,240.00,0.00
30,Janaki Finance Ltd.,1,230.00,230.00,230.00,40.00,9200.00,233.00,-3.00
31,Jyoti Bikas Bank Limited,81,101.00,98.00,101.00,2890.00,287380.00,99.00,2.00
32,Kamana Sewa Bikas Bank Limited,41,113.00,110.00,111.00,1200.00,133600.00,110.00,1.00
33,Kankai Bikas Bank Ltd.,115,99.00,98.00,98.00,1160.00,114740.00,98.00,0.00
34,Karnali Development Bank Limited,9,75.00,74.00,75.00,560.00,41940.00,74.00,1.00
35,Kaski Finance Limited,5,126.00,122.00,122.00,220.00,27020.00,124.00,-2.00
36,Kumari Bank Limited,3,225.00,221.00,221.00,1758.00,391494.00,225.00,-4.00
37,Kumari Bank Limited Promotor Share,6,97.00,96.00,97.00,260.00,24980.00,96.00,1.00
38,Laxmi Bank Limited,6,274.00,260.00,274.00,1024.00,266801.00,260.00,14.00
39,Life Insurance Co. Nepal,2,560.00,560.00,560.00,150.00,84000.00,550.00,10.00
40,Lumbini Bank Limited,4,209.00,208.00,208.00,3411.00,712599.00,209.00,-1.00
41,Lumbini Bikas Bank Ltd.,8,113.00,113.00,113.00,320.00,36160.00,113.00,0.00
42,Lumbini Finance Ltd.,4,134.00,132.00,132.00,390.00,51836.00,132.00,0.00
43,Machhapuchhre Bank Limited,7,121.00,119.00,121.00,1133.00,135914.00,119.00,2.00
44,Mahalaxmi Bikas Bank Ltd.,40,84.00,79.00,79.00,1190.00,96550.00,84.00,-5.00
45,Mahalaxmi BikasBank Limited,17,138.00,138.00,138.00,924.00,127512.00,140.00,-2.00
46,Miteri Development Bank Limited,1,98.00,98.00,98.00,40.00,3920.00,99.00,-1.00
47,Nabil Bank Limited,7,982.00,975.00,982.00,587.00,572737.00,980.00,2.00
48,NABIL Bank Limited Promotor Share,1,820.00,820.00,820.00,212.00,173840.00,836.00,-16.00
49,National Hydro Power Company Limited,9,63.00,60.00,60.00,33097.00,2012517.00,64.00,-4.00
50,Nepal Bangladesh Bank Limited,2,123.00,121.00,121.00,45.00,5475.00,121.00,0.00
51,Nepal Credit And Commercial Bank Limited,1,146.00,146.00,146.00,100.00,14600.00,147.00,-1.00
52,Nepal Doorsanchar Comapany Limited,7,417.00,411.00,411.00,2100.00,867300.00,416.00,-5.00
53,Nepal Investment Bank Limited,14,570.00,550.00,562.00,2204.00,1228930.00,571.00,-9.00
54,Nerude Laghubita Bikas Bank Limited,7,540.00,530.00,540.00,100.00,53350.00,520.00,20.00
55,NIC Asia Bank Ltd.,12,512.00,502.00,503.00,1630.00,826319.00,502.00,1.00
56,Nilgiri Bikas Bank Limited,1,119.00,119.00,119.00,20.00,2380.00,117.00,2.00
57,Nirdhan Utthan Laghubitta Bittiya Sanstha Limited,1,199.00,199.00,199.00,230.00,45770.00,203.00,-4.00
58,NMB Bank Limited,2,172.00,172.00,172.00,186.00,31992.00,175.00,-3.00
59,Om Development Bank Ltd.,18,150.00,146.00,148.00,520.00,76800.00,148.00,0.00
60,Om Finance Ltd.,3,202.00,200.00,200.00,47.00,9445.00,205.00,-5.00
61,Peoples Finance Ltd.,2,216.00,212.00,212.00,714.00,151408.00,220.00,-8.00
62,Prabhu  Bank Limited,6,139.00,137.00,137.00,3520.00,485530.00,139.00,-2.00
63,Prime Commercial Bank Ltd.,26,207.00,195.00,201.00,2738.00,549270.00,201.00,0.00
64,Prime Life Insurance Company Limited,9,168.00,162.00,162.00,910.00,151200.00,167.00,-5.00
65,Public Development Bank Limited,55,61.00,58.00,61.00,840.00,50070.00,61.00,0.00
66,Rastriya Beema Company Limited,14,168.00,160.00,164.00,1169.00,191394.00,170.00,-6.00
67,Reliable Development Bank Limited,4,153.00,150.00,153.00,96.00,14472.00,151.00,2.00
68,Resunga Bikas Bank Limited,16,196.00,187.00,193.00,380.00,73590.00,200.00,-7.00
69,Sagarmatha  Finance Limited,1,125.00,125.00,125.00,12.00,1500.00,123.00,2.00
70,Sewa Bikas Bank Limited,3,120.00,118.00,118.00,41.00,4898.00,118.00,0.00
71,Siddhartha Bank Limited,4,247.00,242.00,247.00,628.00,153782.00,240.00,7.00
72,Siddhartha Insurance Ltd.,5,113.00,111.00,111.00,220.00,24620.00,111.00,0.00
73,Standard Chartered Bank Limited,3,1480.00,1480.00,1480.00,43.00,63640.00,1480.00,0.00
74,Standard Finance Ltd.,2,100.00,98.00,98.00,400.00,39600.00,102.00,-4.00
75,Subha Laxmi Finance Co. Ltd.,53,114.00,112.00,112.00,1080.00,122160.00,111.00,1.00
76,Subhechha Bikas Bank Limited,7,119.00,115.00,115.00,495.00,57365.00,119.00,-4.00
77,Sunrise Bank Limited,13,145.00,137.00,141.00,1039.00,148618.00,139.00,2.00
78,Surya Life Insurance Company Limited,3,118.00,116.00,116.00,140.00,16400.00,118.00,-2.00
79,Swabalamban Laghubitta Bittiya Sanstha Limited,1,200.00,200.00,200.00,308.00,61600.00,204.00,-4.00
80,Tinau Development Bank Limited,2,97.00,97.00,97.00,40.00,3880.00,98.00,-1.00
81,Triveni Bikas Bank Limited,2,154.00,151.00,151.00,38.00,5780.00,157.00,-6.00
82,Udhyam Bikas Bank Limited,3,81.00,80.00,80.00,40.00,3230.00,80.00,0.00
83,Union Finance Co. Ltd.,6,167.00,167.00,167.00,180.00,30060.00,167.00,0.00
84,Unique Finance Ltd.,1,122.00,122.00,122.00,30.00,3660.00,124.00,-2.00
85,United Finance Ltd.,9,158.00,145.00,145.00,591.00,91637.00,161.00,-16.00
86,Valley Finance Limited,14,105.00,105.00,105.00,260.00,27300.00,107.00,-2.00
87,Zenith Finance Limited,64,109.00,106.00,109.00,784.00,83980.00,107.00,2.00
